name,city_id,description,image_url,features,main_activity,activities,sea_type,infrastructure,accessibility,nightlife,tourist_attractions,ad_banner_url,gallery,latitude,longitude,id,created_date,updated_date,created_by,is_sample
"Praia da Enseada","67db2cffee2528e16d1600ae","A Praia da Enseada é a principal praia de São Francisco do Sul, em Santa Catarina. É um destino popular para famílias com crianças, devido às suas águas calmas e tranquilas.  Com uma das melhores infraestruturas da região, a Praia da Enseada é muito procurada por famílias por conta das águas calmas e bom espaço para atividades na areia. Muito movimentada na alta temporada, o local oferece inúmeras atrações durante o verão, que oferece vida noturna também muito movimentada.","https://qtrypzzcjebvfcihiynt.supabase.co/storage/v1/object/public/base44-prod/public/9d257a_enseada1.jpg","[""""Possui cerca de 3 km de extensão"""",""""É ideal para banho"""",""""Está localizada em uma área residencial"""",""""Conta com uma boa estrutura comercial"""",""""Tem vários restaurantes charmosos"""",""""Oferece diversas opções de esportes náuticos""""]","caminhada","[""""Stand up paddle"""",""""Caiaque"""",""""Passeios de barco"""",""""Beach tennis"""",""""Beach soccer"""",""""Futsal""""]","calmo","Banheiros quimicos","calçadas rebaixadas, faixas elevadas para travessia","visitando bares e pubs,  como o Surf Bar,  o Ta Na Onda e o Bar do Banana","[""""mirante no morro Esperança oferece uma vista deslumbrante para quem se aventura a subir seus 264 degraus"""",""""Na ponta da praia, está localizada a escadaria do Morro da Esperança, onde é possível contemplar a vista para praias e costões da região""""]","null","[]","null","null","67cf30412efcee033024d3d2","2025-03-10T18:32:33.731000","2025-03-20T15:23:05.991000","contato.jrsn@gmail.com","false"
"Praia da Joaquina","67cdc32459c2f17692605cc1","Conhecida internacionalmente por suas ondas perfeitas para o surf, a Praia da Joaquina é palco de campeonatos e atrai surfistas do mundo todo. Suas dunas são um atrativo à parte, onde visitantes praticam sandboard.","https://qtrypzzcjebvfcihiynt.supabase.co/storage/v1/object/public/base44-prod/public/a134ea_joaquina-3.jpg","[""""ondas_para_surf"""",""""dunas"""",""""sandboard"""",""""campeonatos_de_surf""""]","caminhada","[]","ondas_medias","Quiosques,  restaurantes,  estacionamento","Média,  com escadas e trilhas","Bares e quiosques durante o verão","[""""Dunas da Joaquina"""",""""Campeonatos de surf""""]","null","[]","null","null","67cf30412efcee033024d3d3","2025-03-10T18:32:33.731000","2025-03-20T15:55:56.335000","contato.jrsn@gmail.com","false"
"Praia de Bombas","67cf30412efcee033024d3d0","Uma das praias mais frequentadas de Bombinhas, possui boa infraestrutura e é ideal para famílias. Suas águas são calmas e perfeitas para banho, com uma extensa faixa de areia onde se pode praticar diversos esportes.","https://qtrypzzcjebvfcihiynt.supabase.co/storage/v1/object/public/base44-prod/public/038170_PORTOBELO.jpg","[""""familiar"""",""""águas_calmas"""",""""esportes_na_areia"""",""""infraestrutura"""",""""salva_vidas"""",""""estacionamento"""",""""chuveiros"""",""""quiosques"""",""""banheiros"""",""""restaurantes""""]","","[]","Calmo, ideal para famílias","Restaurantes,  hotéis,  quiosques,  aluguel de equipamentos","Boa,  com acesso facilitado","Restaurantes e alguns bares","[""""Mirante Eco 360"""",""""Aquário de Bombinhas""""]","null","[]","null","null","67cf30412efcee033024d3d5","2025-03-10T18:32:33.731000","2025-03-20T15:36:37.047000","contato.jrsn@gmail.com","false"
"Praia da Saudade - Prainha","67db2cffee2528e16d1600ae","A Prainha, também conhecida como Praia da Saudade, é uma praia localizada em São Francisco do Sul, Santa Catarina. É uma das praias mais bonitas e limpas da região, e um dos principais pontos turísticos da ilha","https://qtrypzzcjebvfcihiynt.supabase.co/storage/v1/object/public/base44-prod/public/f54bd9_prainha.png","[""""Ideal para surf"""",""""Águas cristalinas e agitadas"""",""""Certificação internacional Bandeira azul"""",""""Frequentada por surfistas""""]","surf","[]","ondas_fortes","Bares, Restaurantes, Banheiros públicos, Chuveiros, Salva vidas, Aluguel de guarda sol e cadeira no local","Rampa de acesso inclinada, travessia elevada","Varios Bares na orla","[""""Costões de pedra com trilhas e vistas panorâmicas""""]","null","[]","null","null","680162d6d72ac111b80742da","2025-04-17T20:21:42.891000","2025-04-17T20:25:25.197000","contato.jrsn@gmail.com","false"
"Praia Grande","67db2cffee2528e16d1600ae","A Praia Grande é uma praia da cidade de São Francisco do Sul, localizada no estado de Santa Catarina, Brasil. É a maior em extensão do município, compreendendo cerca de 25 km em mar aberto. A praia possui ondas violentas, o que favorece a presença de surfistas no local.","https://qtrypzzcjebvfcihiynt.supabase.co/storage/v1/object/public/base44-prod/public/7749da_praiagrande.png","[""""Surf""""]","pesca","[""""Pescarias"""",""""Caminhadas""""]","ondas_fortes","Poucos Bares, Pista de Skate, Banheiro público","Não acessível","Bares, Kiosques","[]","null","[]","null","null","6801b6c02e0cd907afdad52d","2025-04-18T02:19:44.677000","2025-04-18T02:19:44.677000","contato.jrsn@gmail.com","false"
"Praia do Molhe","67db2cffee2528e16d1600ae","A praia do Molhe é uma das praias localizadas no município de São Francisco do Sul, no estado brasileiro de Santa Catarina, localizada entre a Enseada e o Terminal Marítimo da Petrobrás.  De difícil acesso, ela é frequentada geralmente por surfistas e pescadores","https://qtrypzzcjebvfcihiynt.supabase.co/storage/v1/object/public/base44-prod/public/6f2fdb_praia-do-molhe-2.jpg","[""""Praia muito tranquila"""",""""Pra quem gosta de algo mais reservado""""]","pesca","[""""Boa para relaxar"""",""""Boa para crianças""""]","ondas_leves","Salva vidas, Sem banheiros","Sem acessibilidade","Nada pra fazer","[]","null","[]","null","null","6801b8878bbbfe7b52191f34","2025-04-18T02:27:19.383000","2025-04-18T02:27:19.383000","contato.jrsn@gmail.com","false"
"Praia de Itaguaçu","67db2cffee2528e16d1600ae","A praia de Itaguaçu é uma das praias localizadas no município de São Francisco do Sul, no estado brasileiro de Santa Catarina, distante 16 km do centro. Após passar um grande período sem ser frequentada, começou a ganhar maior visibilidade dos turistas no século XXI, onde é utilizada por banhistas, praticantes iniciantes no surfe, pessoas portadoras de reumatismo e praticantes da pesca de tainha.","https://qtrypzzcjebvfcihiynt.supabase.co/storage/v1/object/public/base44-prod/public/af7932_content_7337082.jpg","[""""Pescas"""",""""Surfistas""""]","pesca","[""""Caminhada"""",""""Prática de esportes""""]","ondas_fortes","Salva vidas, Poucos Quiosques","Sem acessibilidade","Alguns Bares, Alguns Restaurantes","[]","null","[]","null","null","6801b9f8d72ac111b807a6b0","2025-04-18T02:33:28.798000","2025-04-18T02:33:28.798000","contato.jrsn@gmail.com","false"
"Praia do Forte","67db2cffee2528e16d1600ae","A Praia do Forte é uma praia em São Francisco do Sul, Santa Catarina, conhecida por suas águas cristalinas, piscinas naturais, e ambiente natural. A praia está localizada ao lado do Forte Marechal Luz, uma base militar histórica","https://qtrypzzcjebvfcihiynt.supabase.co/storage/v1/object/public/base44-prod/public/95927d_forte1.png","[""""Possui duas faixas de areia: uma de mar calmo e outra de mar agitado"""",""""É ideal para a pesca e para o surf"""",""""Recebeu o certificado Bandeira Azul"""",""""Praia boa para familia"""",""""Boa para quem gosta de espaço""""]","relaxamento","[""""É um ótimo lugar para praticar o surf""""]","piscina_natural","Um banheiro Público Bem limpo,  Quiosque","Pouca acessibilidade","Nada para fazer","[""""Forte Marechal Luz""""]","null","[]","null","null","6801bc3d8bbbfe7b5219268a","2025-04-18T02:43:09.914000","2025-04-18T02:44:11.388000","contato.jrsn@gmail.com","false"
"Praia do Capri","67db2cffee2528e16d1600ae","A praia do Capri é uma das praias localizadas no município de São Francisco do Sul, no estado brasileiro de Santa Catarina, sendo a mais isolada do centro da cidade, distante 19 km.  O seu acesso é feito mediante a 6 km da estrada do forte e a mesma se localiza ao lado da Praia do Forte. As principais atrações da praia são passeios de iate e ruínas de um leprosário","https://qtrypzzcjebvfcihiynt.supabase.co/storage/v1/object/public/base44-prod/public/d44686_capri1.png","[""""Águas calmas e limpas"""",""""Faixa de areia espaçosa e fofa"""",""""Abundante fauna marinha""""]","passeio","[""""Boa para banhos e esportes náuticos""""]","ondas_leves","Sem Banheiros, Sem Quiosques, Sem estacionamento","Pouca Acessibilidade","Nada para fazer","[""""Iate Clube do Capri, fundado em 1965"""",""""Ruínas de um leprosário ou lazareto da ponta da costa"""",""""Passarela Estaiada""""]","null","[]","null","null","6801be2284ae02992cbf4bc3","2025-04-18T02:51:14.686000","2025-04-18T02:51:14.686000","contato.jrsn@gmail.com","false"